[
  {
    "experiment_name": "block_toppling",
    "method_name": "baseline",
    "trial_id": 0,
    "random_seed": 0,
    "env_params": {
      "block_width_cm": 7,
      "block_height_cm": 20,
      "block_mass_kg": 0.4,
      "friction_coef": 0.45,
      "aspect_ratio": 2.86
    },
    "task_instruction": "Push the upright block over so it topples.",
    "scene_description": "A rectangular block stands upright on a flat surface. Block dimensions: 7.0cm wide x 20.0cm tall. Mass: 0.40kg. Surface friction coefficient: 0.45. The block is tall and narrow (easy to topple) (aspect ratio 2.9). COM is at height 10.0cm from the ground. Goal: push the block over so it falls (tilt > 60\u00b0).",
    "reasoning_text": "[Baseline: no explicit physics reasoning]\nAction: push block laterally at 25% of height.",
    "action_summary": {
      "contact_height_frac": 0.247,
      "contact_height_cm": 4.9,
      "push_direction": "lateral_right"
    },
    "success": true,
    "metrics": {
      "max_tilt_deg": 61.71,
      "final_theta_deg": 61.71,
      "slid_only": true,
      "steps": 400
    },
    "failure_mode": "success",
    "video_path": "results/videos/exp1_block_toppling/baseline/trial_00.mp4",
    "elapsed_s": 0.002
  },
  {
    "experiment_name": "block_toppling",
    "method_name": "baseline",
    "trial_id": 1,
    "random_seed": 1,
    "env_params": {
      "block_width_cm": 8,
      "block_height_cm": 22,
      "block_mass_kg": 0.5,
      "friction_coef": 0.5,
      "aspect_ratio": 2.75
    },
    "task_instruction": "Push the upright block over so it topples.",
    "scene_description": "A rectangular block stands upright on a flat surface. Block dimensions: 8.0cm wide x 22.0cm tall. Mass: 0.50kg. Surface friction coefficient: 0.50. The block is tall and narrow (easy to topple) (aspect ratio 2.8). COM is at height 11.0cm from the ground. Goal: push the block over so it falls (tilt > 60\u00b0).",
    "reasoning_text": "[Baseline: no explicit physics reasoning]\nAction: push block laterally at 27% of height.",
    "action_summary": {
      "contact_height_frac": 0.27,
      "contact_height_cm": 5.9,
      "push_direction": "lateral_right"
    },
    "success": true,
    "metrics": {
      "max_tilt_deg": 61.2,
      "final_theta_deg": 61.2,
      "slid_only": true,
      "steps": 400
    },
    "failure_mode": "success",
    "video_path": "results/videos/exp1_block_toppling/baseline/trial_01.mp4",
    "elapsed_s": 0.001
  },
  {
    "experiment_name": "block_toppling",
    "method_name": "baseline",
    "trial_id": 2,
    "random_seed": 2,
    "env_params": {
      "block_width_cm": 9,
      "block_height_cm": 18,
      "block_mass_kg": 0.45,
      "friction_coef": 0.55,
      "aspect_ratio": 2.0
    },
    "task_instruction": "Push the upright block over so it topples.",
    "scene_description": "A rectangular block stands upright on a flat surface. Block dimensions: 9.0cm wide x 18.0cm tall. Mass: 0.45kg. Surface friction coefficient: 0.55. The block is moderate aspect ratio (aspect ratio 2.0). COM is at height 9.0cm from the ground. Goal: push the block over so it falls (tilt > 60\u00b0).",
    "reasoning_text": "[Baseline: no explicit physics reasoning]\nAction: push block laterally at 37% of height.",
    "action_summary": {
      "contact_height_frac": 0.373,
      "contact_height_cm": 6.7,
      "push_direction": "lateral_right"
    },
    "success": true,
    "metrics": {
      "max_tilt_deg": 60.98,
      "final_theta_deg": 60.98,
      "slid_only": true,
      "steps": 400
    },
    "failure_mode": "success",
    "video_path": "results/videos/exp1_block_toppling/baseline/trial_02.mp4",
    "elapsed_s": 0.001
  },
  {
    "experiment_name": "block_toppling",
    "method_name": "baseline",
    "trial_id": 3,
    "random_seed": 3,
    "env_params": {
      "block_width_cm": 6,
      "block_height_cm": 24,
      "block_mass_kg": 0.35,
      "friction_coef": 0.4,
      "aspect_ratio": 4.0
    },
    "task_instruction": "Push the upright block over so it topples.",
    "scene_description": "A rectangular block stands upright on a flat surface. Block dimensions: 6.0cm wide x 24.0cm tall. Mass: 0.35kg. Surface friction coefficient: 0.40. The block is tall and narrow (easy to topple) (aspect ratio 4.0). COM is at height 12.0cm from the ground. Goal: push the block over so it falls (tilt > 60\u00b0).",
    "reasoning_text": "[Baseline: no explicit physics reasoning]\nAction: push block laterally at 66% of height.",
    "action_summary": {
      "contact_height_frac": 0.661,
      "contact_height_cm": 15.9,
      "push_direction": "lateral_right"
    },
    "success": true,
    "metrics": {
      "max_tilt_deg": 65.07,
      "final_theta_deg": 65.07,
      "slid_only": false,
      "steps": 16
    },
    "failure_mode": "success",
    "video_path": "results/videos/exp1_block_toppling/baseline/trial_03.mp4",
    "elapsed_s": 0.0
  },
  {
    "experiment_name": "block_toppling",
    "method_name": "baseline",
    "trial_id": 4,
    "random_seed": 4,
    "env_params": {
      "block_width_cm": 10,
      "block_height_cm": 16,
      "block_mass_kg": 0.6,
      "friction_coef": 0.6,
      "aspect_ratio": 1.6
    },
    "task_instruction": "Push the upright block over so it topples.",
    "scene_description": "A rectangular block stands upright on a flat surface. Block dimensions: 10.0cm wide x 16.0cm tall. Mass: 0.60kg. Surface friction coefficient: 0.60. The block is moderate aspect ratio (aspect ratio 1.6). COM is at height 8.0cm from the ground. Goal: push the block over so it falls (tilt > 60\u00b0).",
    "reasoning_text": "[Baseline: no explicit physics reasoning]\nAction: push block laterally at 32% of height.",
    "action_summary": {
      "contact_height_frac": 0.316,
      "contact_height_cm": 5.1,
      "push_direction": "lateral_right"
    },
    "success": false,
    "metrics": {
      "max_tilt_deg": 16.66,
      "final_theta_deg": -9.16,
      "slid_only": false,
      "steps": 400
    },
    "failure_mode": "pushed_too_low_insufficient_torque",
    "video_path": "results/videos/exp1_block_toppling/baseline/trial_04.mp4",
    "elapsed_s": 0.001
  },
  {
    "experiment_name": "block_toppling",
    "method_name": "baseline",
    "trial_id": 5,
    "random_seed": 5,
    "env_params": {
      "block_width_cm": 7,
      "block_height_cm": 21,
      "block_mass_kg": 0.42,
      "friction_coef": 0.48,
      "aspect_ratio": 3.0
    },
    "task_instruction": "Push the upright block over so it topples.",
    "scene_description": "A rectangular block stands upright on a flat surface. Block dimensions: 7.0cm wide x 21.0cm tall. Mass: 0.42kg. Surface friction coefficient: 0.48. The block is tall and narrow (easy to topple) (aspect ratio 3.0). COM is at height 10.5cm from the ground. Goal: push the block over so it falls (tilt > 60\u00b0).",
    "reasoning_text": "[Baseline: no explicit physics reasoning]\nAction: push block laterally at 32% of height.",
    "action_summary": {
      "contact_height_frac": 0.325,
      "contact_height_cm": 6.8,
      "push_direction": "lateral_right"
    },
    "success": true,
    "metrics": {
      "max_tilt_deg": 62.04,
      "final_theta_deg": 62.04,
      "slid_only": true,
      "steps": 400
    },
    "failure_mode": "success",
    "video_path": "results/videos/exp1_block_toppling/baseline/trial_05.mp4",
    "elapsed_s": 0.001
  },
  {
    "experiment_name": "block_toppling",
    "method_name": "baseline",
    "trial_id": 6,
    "random_seed": 6,
    "env_params": {
      "block_width_cm": 8,
      "block_height_cm": 19,
      "block_mass_kg": 0.55,
      "friction_coef": 0.52,
      "aspect_ratio": 2.38
    },
    "task_instruction": "Push the upright block over so it topples.",
    "scene_description": "A rectangular block stands upright on a flat surface. Block dimensions: 8.0cm wide x 19.0cm tall. Mass: 0.55kg. Surface friction coefficient: 0.52. The block is tall and narrow (easy to topple) (aspect ratio 2.4). COM is at height 9.5cm from the ground. Goal: push the block over so it falls (tilt > 60\u00b0).",
    "reasoning_text": "[Baseline: no explicit physics reasoning]\nAction: push block laterally at 51% of height.",
    "action_summary": {
      "contact_height_frac": 0.509,
      "contact_height_cm": 9.7,
      "push_direction": "lateral_right"
    },
    "success": true,
    "metrics": {
      "max_tilt_deg": 61.5,
      "final_theta_deg": 61.5,
      "slid_only": false,
      "steps": 29
    },
    "failure_mode": "success",
    "video_path": "results/videos/exp1_block_toppling/baseline/trial_06.mp4",
    "elapsed_s": 0.0
  },
  {
    "experiment_name": "block_toppling",
    "method_name": "baseline",
    "trial_id": 7,
    "random_seed": 7,
    "env_params": {
      "block_width_cm": 9,
      "block_height_cm": 23,
      "block_mass_kg": 0.38,
      "friction_coef": 0.42,
      "aspect_ratio": 2.56
    },
    "task_instruction": "Push the upright block over so it topples.",
    "scene_description": "A rectangular block stands upright on a flat surface. Block dimensions: 9.0cm wide x 23.0cm tall. Mass: 0.38kg. Surface friction coefficient: 0.42. The block is tall and narrow (easy to topple) (aspect ratio 2.6). COM is at height 11.5cm from the ground. Goal: push the block over so it falls (tilt > 60\u00b0).",
    "reasoning_text": "[Baseline: no explicit physics reasoning]\nAction: push block laterally at 51% of height.",
    "action_summary": {
      "contact_height_frac": 0.506,
      "contact_height_cm": 11.6,
      "push_direction": "lateral_right"
    },
    "success": true,
    "metrics": {
      "max_tilt_deg": 61.24,
      "final_theta_deg": 61.24,
      "slid_only": false,
      "steps": 22
    },
    "failure_mode": "success",
    "video_path": "results/videos/exp1_block_toppling/baseline/trial_07.mp4",
    "elapsed_s": 0.0
  },
  {
    "experiment_name": "block_toppling",
    "method_name": "baseline",
    "trial_id": 8,
    "random_seed": 8,